MATCH_SCORE,PRG_TXT,filtered
72.8,"Equity investments that have readily determinable fair values, including investments for which we have elected the fair value option, are included in Marketable securities on our consolidated balance sheets and measured at fair value with changes recognized in Other income (expense), net on our consolidated statements of operations.","['Equity investments that have readily determinable fair values, including investments for which we have elected the fair value option, are included in Marketable securities on our consolidated balance sheets and measured at fair value with changes recognized in Other income (expense), net on our consolidated statements of operations.']"
72.75,GAAP  means  generally  accepted  accounting  principles  in  the  United  States  as  set  forth  in  the  Accounting  Standards  Codification established by the Financial Accounting Standards Board and defined in FASB ASC 105.,['GAAP  means  generally  accepted  accounting  principles  in  the  United  States  as  set  forth  in  the  Accounting  Standards  Codification established by the Financial Accounting Standards Board and defined in FASB ASC 105.']
72.72,"SEC means the Securities and Exchange Commission, or any Governmental Authority succeeding to any of its principal functions.","['SEC means the Securities and Exchange Commission, or any Governmental Authority succeeding to any of its principal functions.']"
72.67,"Reuters means Thomson Reuters Corporation, Refinitiv or, in each case, a successor thereto.","['Reuters means Thomson Reuters Corporation, Refinitiv or, in each case, a successor thereto.']"
72.66,"We are exposed to market risk for the effect of interest rate changes, foreign currency fluctuations, and changes in the market values of our investments. Information relating to quantitative and qualitative disclosures about market risk is set forth below and in Item 7 of Part II, Management’s Discussion and Analysis of Financial Condition and Results of Operations — Liquidity and Capital Resources.","['Information relating to quantitative and qualitative disclosures about market risk is set forth below and in Item 7 of Part II, Management’s Discussion and Analysis of Financial Condition and Results of Operations — Liquidity and Capital Resources.']"
72.62,"Interim Financial Statements means the unaudited consolidated balance sheet of the Company and its Subsidiaries as of March 31, 2020 and the related consolidated statements of income or operations, stockholders’ equity and cash flows of the Company and its Subsidiaries for the fiscal quarter then ended, including the notes thereto.","['Interim Financial Statements means the unaudited consolidated balance sheet of the Company and its Subsidiaries as of March 31, 2020 and the related consolidated statements of income or operations, stockholders’ equity and cash flows of the Company and its Subsidiaries for the fiscal quarter then ended, including the notes thereto.']"
72.59,"We have a rapidly evolving business model. The trading price of our common stock fluctuates significantly in response to, among other risks, the risks described elsewhere in this Item 1A, as well as changes in interest rates conditions or trends in the Internet and the industry segments we operate in quarterly variations in operating results fluctuations in the stock market in general and market prices for Internetrelated companies in particular changes in financial estimates by us or decisions to increase or decrease future spending or investment levels changes in financial estimates and recommendations by securities analysts changes in our capital structure, including issuance of additional debt or equity to the public changes in the valuation methodology of, or performance by, other ecommerce or technology companies and transactions in our common stock by major investors and certain analyst reports, news, and speculation.","['The trading price of our common stock fluctuates significantly in response to, among other risks, the risks described elsewhere in this Item 1A, as well as changes in interest rates conditions or trends in the Internet and the industry segments we operate in quarterly variations in operating results fluctuations in the stock market in general and market prices for Internetrelated companies in particular changes in financial estimates by us or decisions to increase or decrease future spending or investment levels changes in financial estimates and recommendations by securities analysts changes in our capital structure, including issuance of additional debt or equity to the public changes in the valuation methodology of, or performance by, other ecommerce or technology companies and transactions in our common stock by major investors and certain analyst reports, news, and speculation.']"
72.57,"Governmental Authority means the government of the United States or any other nation, or of any political subdivision thereof, whether state  or  local,  and  any  agency,  authority,  instrumentality,  regulatory  body,  court,  central  bank  or  other  entity  exercising  executive,  legislative, judicial, taxing, regulatory or administrative powers or functions of or pertaining to government (including any supranational bodies such as the European Union or the European Central Bank).","['Governmental Authority means the government of the United States or any other nation, or of any political subdivision thereof, whether state  or  local,  and  any  agency,  authority,  instrumentality,  regulatory  body,  court,  central  bank  or  other  entity  exercising  executive,  legislative, judicial, taxing, regulatory or administrative powers or functions of or pertaining to government (including any supranational bodies such as the European Union or the European Central Bank).']"
72.55,"Control means the possession, directly or indirectly, of the power to direct or cause the direction of the management or policies of a Person, whether through the ability to exercise voting power, by contract or otherwise. Controlling and Controlled have meanings correlative thereto.","['Control means the possession, directly or indirectly, of the power to direct or cause the direction of the management or policies of a Person, whether through the ability to exercise voting power, by contract or otherwise.']"
72.49,"This Annual Report on Form 10K and the documents incorporated herein by reference contain forwardlooking statements based on expectations, estimates, and projections as of the date of this filing. Actual results and outcomes may differ materially from those expressed in forwardlooking statements. See Item 1A of Part I — Risk Factors. As used herein, Amazon.com, we, our, and similar terms include Amazon.com, Inc. and its subsidiaries, unless the context indicates otherwise.",[]
72.46,"Pension Plan means any employee pension benefit plan, as defined in Section 3(2) of ERISA (other than any Multiemployer Plan) that is maintained or is contributed to by the Company and any ERISA Affiliate and is either covered by Title IV of ERISA or is subject to the minimum funding standards under Section 412 of the Code.","['Pension Plan means any employee pension benefit plan, as defined in Section 3(2) of ERISA (other than any Multiemployer Plan) that is maintained or is contributed to by the Company and any ERISA Affiliate and is either covered by Title IV of ERISA or is subject to the minimum funding standards under Section 412 of the Code.']"
72.46,"The goodwill of the acquired companies is primarily related to expected improvements in technology performance and functionality, as well as sales growth from future product and service offerings and new customers, together with certain intangible assets that do not qualify for separate recognition. The goodwill of the acquired companies is generally not deductible for tax purposes. The following summarizes our goodwill activity in 2020 and 2021 by segment (in millions) North  America International Consolidated AWS Goodwill  January 1, 2020 New acquisitions Other adjustments (1) Goodwill  December 31, 2020 New acquisitions Other adjustments (1) Goodwill  December 31, 2021 $ $ 12,264  $ 204  59 12,527  230  1 1,300  $ 6  (18) 1,288  60  (21) 1,190  $ 2  10 1,202  76  8 12,758  $ 1,327  $ 1,286  $ 14,754  212  51 15,017  366  (12) 15,371 (1) Primarily includes changes in foreign exchange rates.","['The goodwill of the acquired companies is primarily related to expected improvements in technology performance and functionality, as well as sales growth from future product and service offerings and new customers, together with certain intangible assets that do not qualify for separate recognition.']"
72.43,"Deferred tax assets represent amounts available to reduce income taxes payable in future periods. Deferred tax assets are evaluated for future realization and reduced by a valuation allowance to the extent we believe they will not be realized. We consider many factors when assessing the likelihood of future realization of our deferred tax assets, including our recent cumulative loss experience and expectations of future earnings, capital gains and investment in such jurisdiction, the carry forward periods available to us for tax reporting purposes, and other relevant factors.","['We consider many factors when assessing the likelihood of future realization of our deferred tax assets, including our recent cumulative loss experience and expectations of future earnings, capital gains and investment in such jurisdiction, the carry forward periods available to us for tax reporting purposes, and other relevant factors.']"
72.41,"Company’s 1997 Stock Incentive Plan, of our reports dated February 3, 2022, with respect to the consolidated financial statements of Amazon.com, Inc. and the effectiveness of internal control over financial reporting of Amazon.com, Inc. included in this Annual Report (Form 10K) of Amazon.com, Inc. for the year ended December 31, 2021.","['Company’s 1997 Stock Incentive Plan, of our reports dated February 3, 2022, with respect to the consolidated financial statements of Amazon.com, Inc. and the effectiveness of internal control over financial reporting of Amazon.com, Inc. included in this Annual Report (Form 10K) of Amazon.com, Inc. for the year ended December 31, 2021.']"
72.4,"Material Subsidiary means any Subsidiary (a) that is a Designated Borrower or (b) that is a significant subsidiary of the Company, as the term significant subsidiary is defined in Regulation SX promulgated by the SEC.","['Material Subsidiary means any Subsidiary (a) that is a Designated Borrower or (b) that is a significant subsidiary of the Company, as the term significant subsidiary is defined in Regulation SX promulgated by the SEC.']"
72.38,Beneficial Ownership Regulation means 31 C.F.R. § 1010.230.,['Beneficial Ownership Regulation means 31 C.F.R. § 1010.230.']
72.38,"Intangible Assets means assets that are considered to be intangible assets under GAAP, including customer lists, goodwill, computer software,  copyrights,  trade  names,  trademarks,  patents,  franchises,  licenses,  unamortized  deferred  charges,  unamortized  debt  discount  and capitalized research and development costs.","['Intangible Assets means assets that are considered to be intangible assets under GAAP, including customer lists, goodwill, computer software,  copyrights,  trade  names,  trademarks,  patents,  franchises,  licenses,  unamortized  deferred  charges,  unamortized  debt  discount  and capitalized research and development costs.']"
72.36,"Assignment and Assumption means an assignment and assumption entered into by a Lender and an Eligible Assignee (with the consent of any party whose consent is required by Section 11.06(b)), and accepted by the Administrative Agent, in substantially the form of Exhibit C or any  other  form  (including  electronic  documentation  generated  by  use  of  an  electronic  platform)  reasonably  satisfactory  to  the  Administrative Agent.","['Assignment and Assumption means an assignment and assumption entered into by a Lender and an Eligible Assignee (with the consent of any party whose consent is required by Section 11.06(b)), and accepted by the Administrative Agent, in substantially the form of Exhibit C or any  other  form  (including  electronic  documentation  generated  by  use  of  an  electronic  platform)  reasonably  satisfactory  to  the  Administrative Agent.']"
72.33,"Resolution Authority means an EEA Resolution Authority or, with respect to any UK Financial Institution, a UK Resolution Authority.","['Resolution Authority means an EEA Resolution Authority or, with respect to any UK Financial Institution, a UK Resolution Authority.']"
72.31,"As of December 31, 2021, there was $16.6 billion of net unrecognized compensation cost related to unvested stockbased compensation arrangements. This compensation is recognized on an accelerated basis with approximately half of the compensation expected to be expensed in the next twelve months, and has a remaining weightedaverage recognition period of 1.1 years. The estimated forfeiture rate as of December 31, 2019, 2020, and 2021 was 27%. Changes in our estimates and assumptions relating to forfeitures may cause us to realize material changes in stockbased compensation expense in the future.","['This compensation is recognized on an accelerated basis with approximately half of the compensation expected to be expensed in the next twelve months, and has a remaining weightedaverage recognition period of 1.1 years.']"
72.29,BailIn Action means the exercise of any WriteDown and Conversion Powers by the applicable Resolution Authority in respect of any liability of any Affected Financial Institution.,['Action means the exercise of any WriteDown and Conversion Powers by the applicable Resolution Authority in respect of any liability of any Affected Financial Institution.']
72.27,"All of these free cash flows measures have limitations as they omit certain components of the overall cash flow statement and do not represent the residual cash flow available for discretionary expenditures. For example, these measures of free cash flows do not incorporate the portion of payments representing principal reductions of debt or cash payments for business acquisitions. Additionally, our mix of property and equipment acquisitions with cash or other financing options may change over time. Therefore, we believe it is important to view free cash flows measures only as a complement to our entire consolidated statements of cash flows.",[]
72.27,"Amazon Capital Funding LLC means Amazon Capital Funding LLC, a Delaware limited liability company, and its successors.","['Amazon Capital Funding LLC means Amazon Capital Funding LLC, a Delaware limited liability company, and its successors.']"
72.26,"Benchmark Replacement Conforming Changes means, with respect to any Benchmark Replacement, any technical, administrative or operational changes (including changes to the definition of Base Rate, the definition of Interest Period, timing and frequency of determining rates and making payments of interest, the deadlines for providing Loan Notices and other administrative matters) that the Administrative Agent determines  in  its  reasonable discretion  may  be  appropriate  to  reflect the  adoption  and  implementation  of  such Benchmark  Replacement  and  to permit the administration thereof by the Administrative Agent in a manner substantially consistent with market practice (or, if the Administrative Agent  determines  in  its  reasonable  discretion  that  adoption  of  any  portion  of  such  market  practice  is  not  administratively  feasible  or  if  the Administrative Agent determines that no market practice for the administration of the Benchmark Replacement exists, in such other manner of administration as the Administrative Agent determines in its reasonable discretion is reasonably necessary in connection with the administration of this Agreement).","['Benchmark Replacement Conforming Changes means, with respect to any Benchmark Replacement, any technical, administrative or operational changes (including changes to the definition of Base Rate, the definition of Interest Period, timing and frequency of determining rates and making payments of interest, the deadlines for providing Loan Notices and other administrative matters) that the Administrative Agent determines  in  its  reasonable discretion  may  be  appropriate  to  reflect the  adoption  and  implementation  of  such Benchmark  Replacement  and  to permit the administration thereof by the Administrative Agent in a manner substantially consistent with market practice (or, if the Administrative Agent  determines  in  its  reasonable  discretion  that  adoption  of  any  portion  of  such  market  practice  is  not  administratively  feasible  or  if  the Administrative Agent determines that no market practice for the administration of the Benchmark Replacement exists, in such other manner of administration as the Administrative Agent determines in its reasonable discretion is reasonably necessary in connection with the administration of this Agreement).']"
72.26,"Because we collect, process, store, and transmit large amounts of data, including confidential, sensitive, proprietary, and business and personal information, failure to prevent or mitigate data loss, theft, misuse, or other security breaches or vulnerabilities affecting our or our vendors’ or customers’ technology, products, and systems, could expose us or our customers to a risk of loss, disclosure, or misuse of such information adversely affect our operating results result in litigation, liability, or regulatory action (including under laws related to privacy, data use, data protection, data security, network security, and consumer protection) deter customers or sellers from using our stores, products, and services and otherwise harm our business and reputation. We use thirdparty technology and systems for a variety of reasons, including, without limitation, encryption and authentication technology, employee email, content delivery to customers, backoffice support, and other functions. Some of our systems have experienced past security breaches, and, although they did not have a material adverse effect on our operating results, there can be no assurance that future incidents will not have material adverse effects on our operations or financial results. Although we have developed systems and processes that are designed to protect customer data and prevent such incidents, including systems and processes designed to reduce the impact of a security breach at a thirdparty vendor or customer, such measures cannot provide absolute security and may fail to operate as intended or be circumvented.","['Although we have developed systems and processes that are designed to protect customer data and prevent such incidents, including systems and processes designed to reduce the impact of a security breach at a thirdparty vendor or customer, such measures cannot provide absolute security and may fail to operate as intended or be circumvented.']"
72.23,"We are continuing to rapidly and significantly expand our global operations, including increasing our product and service offerings and scaling our infrastructure to support our retail and services businesses. The complexity of the current scale of our business can place significant strain on our management, personnel, operations, systems, technical performance, financial resources, and internal financial control and reporting functions, and our expansion increases these factors. Failure to manage growth effectively could damage our reputation, limit our growth, and negatively affect our operating results.","['The complexity of the current scale of our business can place significant strain on our management, personnel, operations, systems, technical performance, financial resources, and internal financial control and reporting functions, and our expansion increases these factors.']"
72.22,"No Advice Regarding Grant. The Company is not providing any tax, legal or financial advice, nor is the Company making any recommendations regarding your participation in the Plan, or your acquisition or sale of the underlying Shares. You are hereby advised to consult with your own personal tax, legal and financial advisors regarding your participation in the Plan before taking any action related to the Plan. 13.","['The Company is not providing any tax, legal or financial advice, nor is the Company making any recommendations regarding your participation in the Plan, or your acquisition or sale of the underlying Shares.']"
72.21,"In addition, we provide regulated services in certain jurisdictions because we enable customers to keep account balances with us and transfer money to third parties, and because we provide services to third parties to facilitate payments on their behalf. Jurisdictions subject us to requirements for licensing, regulatory inspection, bonding and capital maintenance, the use, handling, and segregation of transferred funds, consumer disclosures, maintaining or processing data, and authentication. We are also subject to or voluntarily comply with a number of other laws and regulations relating to payments, money laundering, international money transfers, privacy, data use, data protection, data security, network security, consumer protection, and electronic fund transfers. If we were found to be in violation of applicable laws or regulations, we could be subject to additional requirements and civil and criminal penalties, or forced to cease providing certain services.","['Jurisdictions subject us to requirements for licensing, regulatory inspection, bonding and capital maintenance, the use, handling, and segregation of transferred funds, consumer disclosures, maintaining or processing data, and authentication.']"
72.2,"We are not always able to discover or determine the extent of any unauthorized use of our proprietary rights. Actions taken by third parties that license our proprietary rights may materially diminish the value of our proprietary rights or reputation. The protection of our intellectual property requires the expenditure of significant financial and managerial resources. Moreover, the steps we take to protect our intellectual property do not always adequately protect our rights or prevent third parties from infringing or misappropriating our proprietary rights. We also cannot be certain that others will not independently develop or otherwise acquire equivalent or superior technology or other intellectual property rights.",['The protection of our intellectual property requires the expenditure of significant financial and managerial resources.']
72.19,"Our valuation allowances primarily relate to foreign deferred tax assets, including substantially all of our foreign net operating loss carryforwards as of December 31, 2021. Our foreign net operating loss carryforwards for income tax purposes as of December 31, 2021 were approximately $9.2 billion before tax effects and certain of these amounts are subject to annual limitations under applicable tax law. If not utilized, a portion of these losses will begin to expire in 2022.","['Our valuation allowances primarily relate to foreign deferred tax assets, including substantially all of our foreign net operating loss carryforwards as of December 31, 2021.']"
72.15,"Technology and content costs include payroll and related expenses for employees involved in the research and development of new and existing products and services, development, design, and maintenance of our stores, curation and display of products and services made available in our online stores, and infrastructure costs. Infrastructure costs include servers, networking equipment, and data center related depreciation and amortization, rent, utilities, and other expenses necessary to support AWS and other Amazon businesses. Collectively, these costs reflect the investments we make in order to offer a wide variety of products and services to our customers.","['Infrastructure costs include servers, networking equipment, and data center related depreciation and amortization, rent, utilities, and other expenses necessary to support AWS and other Amazon businesses.']"
72.14,"Imposition of Other Requirements. The Company reserves the right to impose other requirements on your participation in the Plan, on the Award and  on  any  Shares  issued  in  settlement  of  the  Award,  to  the  extent  the  Company  determines  it  is  necessary  or  advisable  for  legal  or  administrative  reasons,  and  to require you to sign any additional agreements or undertakings that may be necessary to accomplish the foregoing. 21.","['The Company reserves the right to impose other requirements on your participation in the Plan, on the Award and  on  any  Shares  issued  in  settlement  of  the  Award,  to  the  extent  the  Company  determines  it  is  necessary  or  advisable  for  legal  or  administrative  reasons,  and  to require you to sign any additional agreements or undertakings that may be necessary to accomplish the foregoing.']"
