MATCH_SCORE,PRG_TXT,filtered
73.46,"In addition to risks described elsewhere in this section, our international sales and operations are subject to a number of risks, including local economic and political conditions government regulation (such as regulation of our product and service offerings and of competition) restrictive governmental actions (such as trade protection measures, including export duties and quotas and custom duties and tariffs) nationalization and restrictions on foreign ownership restrictions on sales or distribution of certain products or services and uncertainty regarding liability for products, services, and content, including uncertainty as a result of less Internetfriendly legal systems, local laws, lack of legal precedent, and varying rules, regulations, and practices regarding the physical and digital distribution of media products and enforcement of intellectual property rights business licensing or certification requirements, such as for imports, exports, web services, and electronic devices limitations on the repatriation and investment of funds and foreign currency exchange restrictions limited fulfillment and technology infrastructure shorter payable and longer receivable cycles and the resultant negative impact on cash flow laws and regulations regarding privacy, data use, data protection, data security, network security, consumer protection, payments, advertising, and restrictions on pricing or discounts lower levels of use of the Internet lower levels of consumer spending and fewer opportunities for growth compared to the U.S. lower levels of credit card usage and increased payment risk difficulty in staffing, developing, and managing foreign operations as a result of distance, language, and cultural differences different employee/employer relationships and the existence of works councils and labor unions compliance with the U.S. Foreign Corrupt Practices Act and other applicable U.S. and foreign laws prohibiting corrupt payments to government officials and other third parties laws and policies of the U.S. and other jurisdictions affecting trade, foreign investment, loans, and taxes and geopolitical events, including war and terrorism.","['In addition to risks described elsewhere in this section, our international sales and operations are subject to a number of risks, including local economic and political conditions government regulation (such as regulation of our product and service offerings and of competition) restrictive governmental actions (such as trade protection measures, including export duties and quotas and custom duties and tariffs) nationalization and restrictions on foreign ownership restrictions on sales or distribution of certain products or services and uncertainty regarding liability for products, services, and content, including uncertainty as a result of less Internetfriendly legal systems, local laws, lack of legal precedent, and varying rules, regulations, and practices regarding the physical and digital distribution of media products and enforcement of intellectual property rights business licensing or certification requirements, such as for imports, exports, web services, and electronic devices limitations on the repatriation and investment of funds and foreign currency exchange restrictions limited fulfillment and technology infrastructure shorter payable and longer receivable cycles and the resultant negative impact on cash flow laws and regulations regarding privacy, data use, data protection, data security, network security, consumer protection, payments, advertising, and restrictions on pricing or discounts lower levels of use of the Internet lower levels of consumer spending and fewer opportunities for growth compared to the U.S. lower levels of credit card usage and increased payment risk difficulty in staffing, developing, and managing foreign operations as a result of distance, language, and cultural differences different employee/employer relationships and the existence of works councils and labor unions compliance with the U.S. Foreign Corrupt Practices Act and other applicable U.S. and foreign laws prohibiting corrupt payments to government officials and other third parties laws and policies of the U.S. and other jurisdictions affecting trade, foreign investment, loans, and taxes and geopolitical events, including war and terrorism.']"
73.46,"Our present and future commercial agreements, strategic alliances, and business relationships create additional risks such as disruption of our ongoing business, including loss of management focus on existing businesses impairment of other relationships variability in revenue and income from entering into, amending, or terminating such agreements or relationships and difficulty integrating under the commercial agreements.","['Our present and future commercial agreements, strategic alliances, and business relationships create additional risks such as disruption of our ongoing business, including loss of management focus on existing businesses impairment of other relationships variability in revenue and income from entering into, amending, or terminating such agreements or relationships and difficulty integrating under the commercial agreements.']"
73.39,"As a result of future acquisitions or mergers, we might need to issue additional equity securities, spend our cash, or incur debt, contingent liabilities, or amortization expenses related to intangible assets, any of which could reduce our profitability and harm our business or only be available on unfavorable terms, if at all. In addition, valuations supporting our acquisitions and strategic investments could change rapidly. We could determine that such valuations have experienced impairments or otherthantemporary declines in fair value which could adversely impact our financial results.","['As a result of future acquisitions or mergers, we might need to issue additional equity securities, spend our cash, or incur debt, contingent liabilities, or amortization expenses related to intangible assets, any of which could reduce our profitability and harm our business or only be available on unfavorable terms, if at all.']"
73.39,"ERISA Event means (a) a Reportable Event with respect to a Pension Plan (b) the withdrawal of the Company or any ERISA Affiliate from  a  Pension  Plan  subject  to  Section  4063  of  ERISA  during  a  plan  year  in  which  such  entity  was  a  substantial  employer  as  defined  in Section 4001(a)(2) of ERISA or a cessation of operations that is treated as such a withdrawal under Section 4062(e) of ERISA (c) a complete or partial withdrawal (within the meanings of Section 4203 or 4205 of ERISA) by the Company or, to the knowledge of the Company, any ERISA Affiliate from a Multiemployer Plan, or notification received by the Company that a Multiemployer Plan is in critical status (within the meaning of Sections 4245 of ERISA) (d) the filing of a notice by the Pension Plan administrator of intent to terminate or the treatment of a Pension Plan amendment as a termination under Section 4041 or 4041A of ERISA (e) the institution by the PBGC of proceedings to terminate a Pension Plan (f) any event or condition which constitutes grounds under Section 4042(a) of ERISA for the termination of, or the appointment of a trustee to administer, any Pension Plan (g) the determination that any Pension Plan is considered an atrisk plan or a plan in endangered or critical status within the meaning of Section 430 of the Code or Section 305 of ERISA or (h) the imposition of any liability under Title IV of ERISA, other than for PBGC premiums due but not delinquent under Section 4007 of ERISA, upon the Company or any ERISA Affiliate.","['ERISA Event means (a) a Reportable Event with respect to a Pension Plan (b) the withdrawal of the Company or any ERISA Affiliate from  a  Pension  Plan  subject  to  Section  4063  of  ERISA  during  a  plan  year  in  which  such  entity  was  a  substantial  employer  as  defined  in Section 4001(a)(2) of ERISA or a cessation of operations that is treated as such a withdrawal under Section 4062(e) of ERISA (c) a complete or partial withdrawal (within the meanings of Section 4203 or 4205 of ERISA) by the Company or, to the knowledge of the Company, any ERISA Affiliate from a Multiemployer Plan, or notification received by the Company that a Multiemployer Plan is in critical status (within the meaning of Sections 4245 of ERISA) (d) the filing of a notice by the Pension Plan administrator of intent to terminate or the treatment of a Pension Plan amendment as a termination under Section 4041 or 4041A of ERISA (e) the institution by the PBGC of proceedings to terminate a Pension Plan (f) any event or condition which constitutes grounds under Section 4042(a) of ERISA for the termination of, or the appointment of a trustee to administer, any Pension Plan (g) the determination that any Pension Plan is considered an atrisk plan or a plan in endangered or critical status within the meaning of Section 430 of the Code or Section 305 of ERISA or (h) the imposition of any liability under Title IV of ERISA, other than for PBGC premiums due but not delinquent under Section 4007 of ERISA, upon the Company or any ERISA Affiliate.']"
73.38,"Organization  Documents  means,  (a)  with  respect  to  any  corporation,  the  certificate  or  articles  of  incorporation  and  the  bylaws  (or equivalent or comparable constitutive documents with respect to any nonU.S. jurisdiction) (b) with respect to any limited liability company, the certificate or articles of formation or organization and operating agreement (or equivalent or comparable constitutive documents with respect to any  nonU.S.  jurisdiction)  and  (c)  with  respect  to  any  partnership,  joint  venture,  trust  or  other  form  of  business  entity,  the  partnership,  joint venture or other applicable agreement of formation or organization and any agreement, instrument, filing or notice with respect thereto filed in connection with its formation or organization with the applicable Governmental Authority in the jurisdiction of its formation or organization and, if applicable, any certificate or articles of formation or organization of such entity.","['Organization  Documents  means,  (a)  with  respect  to  any  corporation,  the  certificate  or  articles  of  incorporation  and  the  bylaws  (or equivalent or comparable constitutive documents with respect to any nonU.S. jurisdiction) (b) with respect to any limited liability company, the certificate or articles of formation or organization and operating agreement (or equivalent or comparable constitutive documents with respect to any  nonU.S.  jurisdiction)  and  (c)  with  respect  to  any  partnership,  joint  venture,  trust  or  other  form  of  business  entity,  the  partnership,  joint venture or other applicable agreement of formation or organization and any agreement, instrument, filing or notice with respect thereto filed in connection with its formation or organization with the applicable Governmental Authority in the jurisdiction of its formation or organization and, if applicable, any certificate or articles of formation or organization of such entity.']"
73.37,"UK Financial Institution means any BRRD Undertaking (as such term is defined under the PRA Rulebook (as amended form time to time) promulgated by the United Kingdom Prudential Regulation Authority) or any Person falling within IFPRU 11.6 of the FCA Handbook (as amended  from  time  to  time)  promulgated  by  the  United  Kingdom  Financial  Conduct  Authority,  which  includes  certain  credit  institutions  and investment firms, and certain Affiliates of such credit institutions or investment firms.","['UK Financial Institution means any BRRD Undertaking (as such term is defined under the PRA Rulebook (as amended form time to time) promulgated by the United Kingdom Prudential Regulation Authority) or any Person falling within IFPRU 11.6 of the FCA Handbook (as amended  from  time  to  time)  promulgated  by  the  United  Kingdom  Financial  Conduct  Authority,  which  includes  certain  credit  institutions  and investment firms, and certain Affiliates of such credit institutions or investment firms.']"
73.36,"Regulation G, Conditions for Use of NonGAAP Financial Measures, and other SEC regulations define and prescribe the conditions for use of certain nonGAAP financial information. Our measures of free cash flows and the effect of foreign exchange rates on our consolidated statements of operations meet the definition of non GAAP financial measures.",['Our measures of free cash flows and the effect of foreign exchange rates on our consolidated statements of operations meet the definition of non GAAP financial measures.']
73.35,"Because of its inherent limitations, internal control over financial reporting may not prevent or detect misstatements. Also, projections of any evaluation of effectiveness to future periods are subject to the risk that controls may become inadequate because of changes in conditions, or that the degree of compliance with the policies or procedures may deteriorate.",[]
73.25,"As of January 26, 2022, there were 7,282 shareholders of record of our common stock, although there is a much larger number of beneficial owners.","['As of January 26, 2022, there were 7,282 shareholders of record of our common stock, although there is a much larger number of beneficial owners.']"
73.2,"Report of Ernst & Young LLP, Independent Registered Public Accounting Firm (PCAOB ID 42) Consolidated Statements of Cash Flows Consolidated Statements of Operations Consolidated Statements of Comprehensive Income Consolidated Balance Sheets Consolidated Statements of Stockholders’ Equity Notes to Consolidated Financial Statements Page 34 36 37 38 39 40 41 The Board of Directors and Shareholders Amazon.com, Inc.","['Report of Ernst & Young LLP, Independent Registered Public Accounting Firm (PCAOB ID 42) Consolidated Statements of Cash Flows Consolidated Statements of Operations Consolidated Statements of Comprehensive Income Consolidated Balance Sheets Consolidated Statements of Stockholders’ Equity Notes to Consolidated Financial Statements Page 34 36 37 38 39 40 41 The Board of Directors and Shareholders Amazon.com, Inc.']"
73.11,"Marketable fixed income securities are classified as availableforsale and reported at fair value with unrealized gains and losses included in Accumulated other comprehensive income (loss). Each reporting period, we evaluate whether declines in fair value below carrying value are due to expected credit losses, as well as our ability and intent to hold the investment until a forecasted recovery occurs. Expected credit losses are recorded as an allowance through Other income (expense), net on our consolidated statements of operations.",['Marketable fixed income securities are classified as availableforsale and reported at fair value with unrealized gains and losses included in Accumulated other comprehensive income (loss).']
73.1,"We involved our international tax, transfer pricing, and research and development tax professionals in assessing the technical merits of certain of the Company’s tax positions. Depending on the nature of the specific tax position and, as applicable, developments with the relevant tax authorities relating thereto, our procedures included obtaining and examining the Company’s analysis including the Company’s correspondence with such tax authorities and evaluating the underlying facts upon which the tax positions are based. We used our knowledge of and experience with international, transfer pricing, and other income tax laws by the relevant income tax authorities to evaluate the Company’s accounting for its tax contingencies. We evaluated developments in the applicable regulatory environments to assess potential effects on the Company’s positions, including recent decisions in relevant court cases. We analyzed the appropriateness of the Company’s valuation methodologies and assumptions, including the determination of forecasts of income or loss, and the accuracy of the Company’s calculations and data used to determine the amount of tax benefits to recognize. We have also evaluated the Company’s income tax disclosures in relation to these matters.","['We analyzed the appropriateness of the Company’s valuation methodologies and assumptions, including the determination of forecasts of income or loss, and the accuracy of the Company’s calculations and data used to determine the amount of tax benefits to recognize.']"
73.04,"Unless the Plan Administrator determines otherwise, a transfer of employment or services between or among the Company and its Subsidiaries shall not be considered  a  termination  of  employment.  Further,  unless  the  Plan  Administrator  determines  otherwise,  including  through  policies  it  may  adopt  from  time  to  time regarding parttime work arrangements or reduced work schedules, and except as otherwise required by local law, for purposes of this Award only, any reduction in your regular  hours of employment  to less than thirty  hours per week is deemed  a termination  of your employment  with the Company or any Subsidiary. In case of termination of your employment for Cause or for a violation of the Company’s code of business conduct and ethics, the Award shall automatically terminate upon first notification to you of such termination, unless the Plan Administrator determines otherwise. If your employment is suspended pending an investigation of whether you should be terminated for Cause or for a violation of the Company’s code of business conduct and ethics, all of your rights under the Award likewise may be suspended during the period of investigation. The Plan Administrator, the Vice President of Human Resources, the Associate General Counsel, Labor and Employment, or any other  officer  of  the  Company  delegated  such  authority  by  the  Plan  Administrator  shall  have  the  exclusive  discretion  to  determine  when  you  are  no  longer  actively providing  services  to  the  Company  or  any  Subsidiary  or  when  your  rights  under  the  Award  may  be  suspended  pending  an  investigation  of  whether  you  should  be terminated for Cause or a violation of the Company’s code of business conduct and ethics. 7.","['The Plan Administrator, the Vice President of Human Resources, the Associate General Counsel, Labor and Employment, or any other  officer  of  the  Company  delegated  such  authority  by  the  Plan  Administrator  shall  have  the  exclusive  discretion  to  determine  when  you  are  no  longer  actively providing  services  to  the  Company  or  any  Subsidiary  or  when  your  rights  under  the  Award  may  be  suspended  pending  an  investigation  of  whether  you  should  be terminated for Cause or a violation of the Company’s code of business conduct and ethics.']"
73.0,"Recoupment. By entering into this Agreement and accepting the Award, you agree that if, at the time of grant of this Award or at any time thereafter, you (a) are an officer required to file reports under Section 16 of the Securities Exchange Act of 1934, as amended, or (b) become employed at level 11 or above, this Award  and  any  other  equity  awards  granted  to  you,  the  shares  issuable  or  issued  under  any  such  awards,  the  proceeds  from  sales  of  any  such  shares,  and  any  cash bonuses  paid  to  you  by  the  Company  are  subject  to  recoupment  pursuant  to  the  Company's  clawback  policy  contained  in  the  Guidelines  on  Significant  Corporate Governance Issues, as amended from time to time. 23.","[""By entering into this Agreement and accepting the Award, you agree that if, at the time of grant of this Award or at any time thereafter, you (a) are an officer required to file reports under Section 16 of the Securities Exchange Act of 1934, as amended, or (b) become employed at level 11 or above, this Award  and  any  other  equity  awards  granted  to  you,  the  shares  issuable  or  issued  under  any  such  awards,  the  proceeds  from  sales  of  any  such  shares,  and  any  cash bonuses  paid  to  you  by  the  Company  are  subject  to  recoupment  pursuant  to  the  Company's  clawback  policy  contained  in  the  Guidelines  on  Significant  Corporate Governance Issues, as amended from time to time.""]"
72.99,"Equity warrant valuation gains (losses) Upward adjustments relating to equity investments in private companies Foreign currency gains (losses) Other, net Total other income (expense), net $ Year Ended December 31, 7  $ 11  328  (20) (123) 525  $ 1,527  342  35  (58) 2,371 11,526  1,315  1,866  (55) (19) 14,633 Included in other income (expense), net in 2021 is a marketable equity securities valuation gain of $11.8 billion from our equity investment in Rivian Automotive, Inc. (Rivian). Our investment in Rivian’s preferred stock was accounted for at cost, with adjustments for observable changes in prices or impairments, prior to Rivian’s initial public offering in November 2021, which resulted in the conversion of our preferred stock to Class A common stock. As of December 31, 2021, we held 158 million shares of Rivian’s Class A common stock, representing an approximate 18% ownership interest, and an approximate 16% voting interest. We determined that we have the ability to exercise significant influence over Rivian through our equity investment, our commercial arrangement for the purchase of electric vehicles, and one of our employees serving on Rivian’s board of directors. We elected the fair value option to account for our equity investment in Rivian, and the 2021 valuation gain is primarily comprised of the gain recognized upon the initial public offering, and also includes subsequent changes in fair value through December 31, 2021. As of December 31, 2021, our equity investment in Rivian had a fair value of $15.6 billion, which reflects a discount for lack of marketability until Q1 2022 of approximately $800 million due to regulatory sales restrictions, and is included in Marketable securities on our consolidated balance sheets.","['We elected the fair value option to account for our equity investment in Rivian, and the 2021 valuation gain is primarily comprised of the gain recognized upon the initial public offering, and also includes subsequent changes in fair value through December 31, 2021.']"
72.96,UK  Resolution  Authority  means  the  Bank  of  England  or  any  other  public  administrative  authority  having  responsibility  for  the resolution of any UK Financial Institution.,['UK  Resolution  Authority  means  the  Bank  of  England  or  any  other  public  administrative  authority  having  responsibility  for  the resolution of any UK Financial Institution.']
72.94,Multiemployer Plan means any employee benefit plan of the type described in Section 4001(a)(3) of ERISA that is subject to Title IV of ERISA and to which the Company or any ERISA Affiliate makes or is obligated to make contributions.,['Multiemployer Plan means any employee benefit plan of the type described in Section 4001(a)(3) of ERISA that is subject to Title IV of ERISA and to which the Company or any ERISA Affiliate makes or is obligated to make contributions.']
72.9,"Executive Chair President and Chief Executive Officer CEO Worldwide Consumer Senior Vice President and Chief Financial Officer Vice President, Worldwide Controller, and Principal Accounting Officer CEO Amazon Web Services Senior Vice President, General Counsel, and Secretary Jeffrey P. Bezos. Mr. Bezos founded Amazon.com in 1994 and has served as Executive Chair since July 2021. He has served as Chair of the Board since 1994 and served as Chief Executive Officer from May 1996 until July 2021, and as President from 1994 until June 1999 and again from October 2000 to July 2021.","['Executive Chair President and Chief Executive Officer CEO Worldwide Consumer Senior Vice President and Chief Financial Officer Vice President, Worldwide Controller, and Principal Accounting Officer CEO Amazon Web Services Senior Vice President, General Counsel, and Secretary Jeffrey P. Bezos.']"
72.88,"Basic earnings per share is calculated using our weightedaverage outstanding common shares. Diluted earnings per share is calculated using our weighted average outstanding common shares including the dilutive effect of stock awards as determined under the treasury stock method. In periods when we have a net loss, stock awards are excluded from our calculation of earnings per share as their inclusion would have an antidilutive effect.",[]
72.82,"We tested controls over the Company’s process to assess the technical merits of its tax contingencies, including controls over the assessment as to whether a tax position is more likely than not to be sustained measurement of the benefit of its tax positions, including the selection of valuation methodologies and assumptions determination of forecasts of income or loss and development of the related disclosures.","['We tested controls over the Company’s process to assess the technical merits of its tax contingencies, including controls over the assessment as to whether a tax position is more likely than not to be sustained measurement of the benefit of its tax positions, including the selection of valuation methodologies and assumptions determination of forecasts of income or loss and development of the related disclosures.']"
